{
  "schema_version": "0.1.0",
  "project": {
    "name": "StackFire",
    "ticker": "SFR",
    "category": "community",
    "description": "StackFire is a community membership asset formed through HACD Stack, giving each holder a verifiable PoW-backed formation record.",
    "website": "https://stackfire.hacd",
    "x": "@StackFireHACD",
    "contact": "stackfire@hacdlabs.io"
  },
  "asset": {
    "type": "FT",
    "total_supply": 1000000,
    "decimals": 0,
    "unit_name": "SFR",
    "utility_summary": "Each SFR unit represents one share of a community membership slot formed through a HACD Stack lot. Holders can use SFR for community governance participation (planned) and access gated community resources."
  },
  "stack": {
    "total_hacd_lots": 100,
    "hacd_per_lot": 1,
    "units_per_hacd_lot": 10000,
    "stack_cost_hac_per_hacd": 50,
    "network_fee_required": true,
    "designated_address_required": false,
    "designated_address": "",
    "first_phase_hacd_lots": 0,
    "public_phase_hacd_lots": 100,
    "removal_effect": "burn"
  },
  "launch": {
    "target_date_utc": "2026-08-01T12:00:00Z",
    "launchpad_url": "",
    "phase_model": "public",
    "min_hacd_per_participant": 1,
    "max_hacd_per_participant": 10,
    "status": "draft"
  },
  "copy": {
    "headline": "Community membership, formed through HACD.",
    "subheadline": "StackFire issues SFR — a community Stack Asset with a visible PoW formation cost and hard-capped supply.",
    "short_description": "SFR is formed across 100 HACD lots at 50 HAC each. Total supply is 1,000,000 SFR. No inflation. No hidden allocation. Formed on-chain.",
    "risk_disclosure": "SFR is a community Stack Asset, not an investment product. No price, liquidity, listing, or return is guaranteed. Future utility features depend on development. Formation cost is non-refundable. This is a draft structure pending HACD Labs review."
  },
  "review": {
    "issuer_confirmed": false,
    "hacd_labs_reviewed": false,
    "legal_review_required": true,
    "notes": [
      "Test project generated by HACD Incubator AI Issuance Skill.",
      "All parameters marked as draft. Issuer confirmation required before Launchpad publication.",
      "Governance utility is planned only — must not be promised in public copy.",
      "Maximum 10 HACD per participant must be enforced at Launchpad level."
    ]
  }
}
