{
  "schema_version": "0.1.0",
  "project": {
    "name": "HacashBuilders",
    "ticker": "BUILD",
    "category": "community",
    "description": "HacashBuilders is a hybrid builder-community asset formed through HACD Stack. Each unique HACD becomes a permanent Builder ID and forms a fixed share of the fungible BUILD token.",
    "website": "https://hacashbuilders.hacd",
    "x": "@HacashBuilders",
    "contact": "hacashbuilders@hacdlabs.io"
  },
  "asset": {
    "type": "HYBRID",
    "total_supply": 10000000,
    "decimals": 0,
    "unit_name": "BUILD",
    "utility_summary": "Each BUILD unit represents one share of a builder-community membership formed through a HACD Stack lot, while the unique HACD name acts as a permanent on-chain Builder ID. Holders can use BUILD for community participation and (planned) governance weight and builder-network access."
  },
  "stack": {
    "total_hacd_lots": 500,
    "hacd_per_lot": 1,
    "units_per_hacd_lot": 20000,
    "stack_cost_hac_per_hacd": 50,
    "network_fee_required": true,
    "designated_address_required": false,
    "designated_address": "",
    "first_phase_hacd_lots": 0,
    "public_phase_hacd_lots": 500,
    "removal_effect": "burn"
  },
  "launch": {
    "target_date_utc": "2026-08-01T12:00:00Z",
    "launchpad_url": "",
    "phase_model": "public",
    "min_hacd_per_participant": 1,
    "max_hacd_per_participant": 10,
    "status": "draft"
  },
  "copy": {
    "headline": "Builder identity, formed through HACD.",
    "subheadline": "HacashBuilders issues BUILD — a hybrid community asset where each HACD becomes a permanent Builder ID and forms a fixed share of a hard-capped supply.",
    "short_description": "BUILD is formed across 500 HACD lots at 50 HAC each. Each lot forms 20,000 BUILD and one unique Builder ID. Total supply is 10,000,000 BUILD. No inflation. No hidden allocation. Formed on-chain.",
    "risk_disclosure": "BUILD is a community Stack Asset, not an investment product. No price, liquidity, listing, or return is guaranteed. Future utility features (governance, builder-network access) depend on development. Formation cost is non-refundable. This is a draft structure pending HACD Labs review."
  },
  "review": {
    "issuer_confirmed": false,
    "hacd_labs_reviewed": false,
    "legal_review_required": true,
    "notes": [
      "Generated by HACD Incubator AI Issuance Skill for HacashBuilders.",
      "All parameters marked as draft. Issuer confirmation required before Launchpad publication.",
      "Hybrid FT+NFT: BUILD is the fungible balance, the HACD name is the unique Builder ID. Confirm transferability intent for the Builder ID.",
      "Governance and builder-network utility are planned only — must not be promised in public copy.",
      "Maximum 10 HACD per participant must be enforced at Launchpad level.",
      "500 lots is 5x the StackFire reference — HACD Labs should confirm demand and consider a phased rollout."
    ]
  }
}
